{
  "schemaVersion": 1,
  "policy": "bookself-arr-v1",
  "work": { "title": "Bottleneck: The Innermost Loop of Powering Intelligent Machines", "author": "Sven Hard Benson" },
  "copyright": { "owner": "Sven Hard Benson", "year": 2026, "notice": "© 2026 Sven Hard Benson. All Rights Reserved." },
  "license": { "id": "ARR", "label": "All Rights Reserved", "file": "RIGHTS.md" },
  "permissions": { "publicReading": true, "conventionalSearch": true, "reproduction": false, "distribution": false, "derivatives": false, "commercialUse": false, "aiTraining": false, "aiGenerativeUse": false, "aiRetrievalGrounding": false, "aiIndexing": false, "syntheticNarration": false, "syntheticTranslation": false },
  "registration": { "jurisdiction": "US", "status": "not-recorded-in-bookself", "number": null, "effectiveDate": null }
}
